{
  "lessonId": "pancasila_l01",
  "curriculumId": "pancasila_human",
  "lessonNumber": 1,
  "stageIndex": 1,
  "title": "Bài 1: Thân Người Khó Được — Bọng Cây Giữa Biển Khơi",
  "paliTitle": "Dutiya Chiggalasutta (SN 56.48)",
  "suttaRef": {
    "uid": "sn56.48",
    "title": "Kinh Bọng Cây Thứ Hai (SN 56.48 - Tương Ưng Sự Thật)",
    "excerptPali": "Seyyathāpi, bhikkhave, mahāsamuddo. Tatra puriso ekachiggalaṃ yugaṃ pakkhipeyya. Tamevapuratthimo vāto pacchimena saṃhareyya, pacchimo vāto puratthena saṃhareyya... Tattha kasso kānopuriso... vassasatasataṃ ekavāraṃ ummujjanto tassa ekachiggalassa yugassa gīvaṃ paveseyyāti? 'Kicchena, bhante'... Evameva kho, bhikkhave, kiccho manussattapaṭilābho.",
    "excerptTranslation": "Ví như, này các Tỳ-kheo, một người quăng một chiếc ách có một lỗ thủng vào biển lớn. Gió đông trôi nó về tây, gió tây trôi nó về đông... Tại đấy có một con rùa mù, cứ mỗi trăm năm nổi lên một lần. Con rùa ấy có thể chui cổ vào chiếc ách một lỗ ấy không? 'Rất khó, bạch Thế Tôn'... Cũng vậy, này các Tỳ-kheo, khó thay là được làm người!"
  },
  "pariyatti": {
    "shortSummary": "Đức Phật chỉ rõ cơ hội được làm người là hy hữu tột bậc trong luân hồi (Saṃsāra). Hầu hết chúng sinh sau khi mạng chung đều rơi vào bốn đọa xứ (địa ngục, ngạ quỷ, súc sinh, a-tu-la). Thấu suốt sự quý giá của kiếp người để sống không buông lung phóng dật.",
    "coreConcepts": [
      {
        "term": "Thân Người Khó Được",
        "pali": "Manussattapaṭilābho",
        "definition": "Sự hy hữu tột cùng của việc có được một thân mạng loài người với đầy đủ sáu căn lành lặn, trí tuệ minh mẫn và cơ duyên gặp gỡ Chánh Pháp."
      },
      {
        "term": "Bốn Đọa Xứ",
        "pali": "Cattāro Apāyā",
        "definition": "Bốn cõi giới thống khổ và si mê tăm tối: Địa ngục (Niraya), Ngạ quỷ (Peta), Súc sinh (Tiracchāna), và A-tu-la (Asura); nơi chúng sinh chỉ đền trả nghiệp dữ mà không có cơ hội gieo trồng thiện pháp."
      },
      {
        "term": "Không Phóng Dật",
        "pali": "Appamāda",
        "definition": "Tâm thế tỉnh giác, cảnh giác cao độ, không buông thả theo các dục lạc tạm bợ; nhận thức rõ thời gian của kiếp người trôi qua như bóng câu qua cửa sổ."
      },
      {
        "term": "Đầy Đủ Cơ Duyên Lành",
        "pali": "Khaṇasampatti",
        "definition": "Tám thuận duyên hy hữu để tu học giải thoát (sinh làm người, căn thân đầy đủ, sinh nơi có Chánh pháp, gặp thời Phật Pháp còn lưu truyền, có Chánh tín)."
      }
    ],
    "expositionMarkdown": "### 1. Ẩn Dụ Con Rùa Mù — Xác Suất Kỳ Diệu Của Kiếp Người\n\nTrong **Kinh Bọng Cây (SN 56.48)**, Đức Phật đưa ra một ví dụ gây chấn động tâm thức:\nGiả sử toàn bộ địa cầu này ngập chìm trong một đại dương mênh mông không bờ bến. Trên mặt biển, có một chiếc khúc gỗ rỗng một cái lỗ duy nhất, trôi dạt vô định theo bốn phương tám hướng của ngọn gió. Dưới đáy biển sâu thẳm, có một con rùa bị mù cả hai mắt, cứ đúng **100 năm** mới trồi lên mặt nước một lần duy nhất.\n\nĐức Thế Tôn hỏi chư Tỳ-kheo: *'Liệu con rùa mù ấy, sau trăm năm ngoi lên một lần, có thể may mắn chui đúng cổ mình vào chiếc lỗ của khúc gỗ trôi nổi kia không?'*\nTôn giả Ānanda thưa: *'Bạch Thế Tôn, điều ấy nếu có xảy ra thì cũng là sự ngẫu nhiên vô cùng hy hữu sau vô lượng kiếp!'*\n\nĐức Phật xác quyết:\n> **'Này các Tỳ-kheo, con rùa mù chui cổ vào bọng cây trôi nổi ấy còn dễ hơn cơ hội một kẻ phàm phu một khi đã rơi xuống đọa xứ mà được tái sinh trở lại làm người!'**\n\n---\n\n### 2. Tại Sao Lại Rơi Xuống Đọa Xứ Dễ Đến Thế?\n\nĐức Phật giải thích rằng: Trong bốn đọa xứ (*Apāya*), các loài súc sinh, ngạ quỷ, địa ngục **hoàn toàn không có hành xử thuận theo Chánh Pháp, không có sự công bằng, không có việc làm lành lánh dữ, mà chúng chỉ tàn sát lẫn nhau, loài mạnh nuốt loài yếu, ngập tràn tham lam và sợ hãi**. Một khi đã rơi vào đó, nghiệp bất thiện tiếp tục chồng chất nghiệp bất thiện, như hòn đá chìm sâu vào đáy vực, không biết đến kiếp nào mới ngoi lên được.\n\nCon người ở cõi thế gian này, tuy mang hình hài người, nhưng nếu cả ngày chỉ sống bằng:\n- Tâm tham lam, bủn xỉn, cướp đoạt → đó là tâm trạng thái của **Ngạ quỷ**.\n- Tâm sân hận, căm thù, bạo lực, sát hại → đó là hạt giống của **Địa ngục**.\n- Tâm si mê, sống buông thả theo bản năng tính dục và ăn ngủ, không phân biệt thiện ác → đó là dòng tâm thức của **Súc sinh**.\n\nĐến khi hơi thở cuối cùng dứt đoạn, tâm thức tương ưng với cảnh giới nào thì sẽ lập tức bị lực hút nghiệp báo kéo về cảnh giới đó.\n\n---\n\n### 3. 'Chiếc Bè Báu' Duy Nhất Để Vượt Thoát Luân Hồi\n\nTrong Tam giới (Dục giới, Sắc giới, Vô sắc giới):\n- Các cõi Trời (*Deva*): Hạnh phúc quá nhiều, ngũ dục quá vi diệu khiến chư thiên dễ đắm say, buông lung (*Pamāda*), khó sinh tâm nhàm chán sinh tử.\n- Các cõi Khổ (*Apāya*): Khổ đau cùng cực, si mê tột độ, không thể nghe Pháp và hành thiền.\n- **Chỉ có cõi Người (*Manussa-loka*)**: Là nơi có sự đan xen giữa Khổ đau (*Dukkha*) và Niềm vui, có vừa đủ thử thách để thấy rõ bản chất Vô thường, và có vừa đủ trí tuệ để thấu suốt Tứ Diệu Đế, thực hành Bát Chánh Đạo.\n\nChính vì vậy, chư Phật toàn giác trong mười phương đều chỉ thị hiện và thành đạo tại cõi người! Được làm người là ta đang nắm trong tay **'tấm vé vàng'** độc nhất vô nhị.\n\n---\n\n### 4. Sống Không Buông Lung (*Appamāda*)\n\nBiết được thân người khó được, người có trí tuệ không bao giờ dám:\n1. Đem cuộc đời mình đổi lấy những cuộc vui nhậu nhẹt thâu đêm, những trò tiêu khiển cờ bạc, lướt mạng vô bổ.\n2. Nuôi dưỡng lòng oán hận, đố kỵ với người khác — vì mỗi giây phút sân hận là một viên gạch lát đường xuống địa ngục.\n3. Chần chừ việc tu tập: Đừng hẹn 'khi nào già rồi sẽ tu', vì không ai biết trước cái chết hay ngày mai, điều nào sẽ đến trước!",
    "commonMisconceptions": [
      {
        "mistake": "Cho rằng kiếp sau mình mặc nhiên sẽ lại được sinh làm người, hoặc tin có một linh hồn bất biến chuyển kiếp.",
        "correction": "Đức Phật phủ nhận thuyết linh hồn bất tử. Thân tâm chỉ là dòng chảy duyên sinh của Năm Uẩn. Việc tái sinh hoàn toàn do Nghiệp lực (Kamma) dẫn dắt. Thiếu Giới đức (Sīla) và Thiện nghiệp thì chắc chắn rơi vào đọa xứ."
      },
      {
        "mistake": "Nghĩ rằng muốn kiếp sau làm người giàu sang chỉ cần đi chùa cầu xin, cúng lễ tốn kém hoặc đốt nhiều vàng mã.",
        "correction": "Đây là tà kiến mê tín. Không thần linh nào ban phát được thân người. Điều kiện chân chính để bảo toàn thân người là giữ gìn Ngũ Giới trong sạch và tu tập Thập Thiện Nghiệp Đạo."
      }
    ]
  },
  "patipatti": {
    "practiceGuide": "1. **Quán Chiếu Đầu Ngày:** Mỗi sáng thức dậy, đặt bàn tay lên ngực, hít thở 3 hơi chánh niệm và tự nhắc nhở: 'Hôm nay ta vẫn còn may mắn được sống làm một con người lành lặn. Ta nguyện không để một ngày trôi qua trong vô ích và tội lỗi.'\n2. **Thực Hành Tiết Kiệm Thời Gian Tỉnh Thức:** Giảm bớt 30-60 phút lướt mạng xã hội vô bổ để chuyển hóa thành thời gian đọc một bài kinh Pāḷi hoặc tọa thiền quán sát hơi thở.\n3. **Liên Kết Thời Khóa:** Kết hợp thời khóa buổi sáng (r_morning) với tâm niệm tri ân cuộc sống.",
    "recommendedRoutineId": "r_morning",
    "suggestedVirtue": "Trân quý từng giây phút làm người, kiên quyết không phung phí thời gian vào ác pháp và chuyện vô bổ."
  },
  "pativedha": {
    "reflectionPrompt": "Nếu hôm nay là ngày cuối cùng bạn được mang thân người, bạn nhìn lại cuộc đời mình với sự thanh thản vì đã sống trọn vẹn giới đức, hay ngập tràn ân hận vì đã phung phí thời gian vào tham sân si?",
    "selfAuditChecklist": [
      "Tôi nhận thức rõ sự hy hữu của kiếp người và không coi sự sống là điều đương nhiên.",
      "Hôm nay tôi không phung phí thời gian vào các trò tiêu khiển kích động tham sân hay buôn chuyện thị phi.",
      "Tôi đã gieo được ít nhất một hạt giống thiện nghiệp (bố thí, ái ngữ, chánh niệm) trong ngày.",
      "Khi đối diện với cái chết hay sự vô thường, tâm tôi có nơi nương tựa vững chắc là Chánh Pháp."
    ]
  }
}